,TenBaiHat,TacGia,TheLoai,,
1000,Tượng Đài Chiến Thắng,Khuất Duy Hà Nội,1,,
1001,Hòn Vọng Phu 3,Lạc Việt,1,,
1002,Trống Đồng Dâng Bến Nhà Rồng Nhớ Bác,"Thu Hà, Minh Quang",1,,
1003,LK Tìm Về Lời Ru - Đất Nước Lời Ru,Tân Nhàn,1,,
1004,Hồ Chí Minh Đẹp Nhất Tên Người,Hoàng Tú,1,,
1005,Trường Ca Sông Lô,Hoàng Tú,1,,
1006,Tiếng Hát Từ Thành Phố Mang Tên Người,Hoàng Tú,1,,
1007,Bài Ca Thanh Niên Tình Nguyện,"Nguyễn Thái Hiệp, Nguyễn Phi Hùng",1,,
1008,Ta Tự Hào Đi Lên,Quốc Hưng (NSND),1,,
1009,Hát Về Quê Hương Đại Tướng Võ Nguyên Giáp,V.A,1,,
1010,Miền Trung Nhớ Bác,Hoàng Việt,1,,
1011,Ngồi Nghe Sóng Kể Chuyện,"Nguyễn Ngọc Thiện, Hữu Đức",1,,
1012,Chúng Tôi Là Lính Tàu Ngầm,"Y Jang Tuyn, Max Nguyễn, Nguyễn Đức",1,,
1013,Cuộc Sống Ơi Ta Mến Yêu Người,Lạc Việt,1,,
1014,Người Là Bác Tôn,Lạc Việt,1,,
1015,Dấu Chân Phía Trước,Bùi Thắng,1,,
1016,Điện Biên Mùa Xuân Về,Thái Hoàng Trung,1,,
1017,Đất Nước Trọn Niềm Vui,Thái Hoàng Trung,1,,
1018,Đời Anh Chiến Sĩ,Quách Tuấn Du,1,,
1019,Vầng Trăng Lăng Bác,Tuýnh Nhật Minh,1,,
1020,Bâng Khuâng Trường Sa,Long Nhật,1,,
1021,Lửa Thiêng Dân Tộc,Phan Mạnh Thắng,1,,
1022,Bước Chân Trên Dãy Trường Son,Lạc Việt,1,,
1023,Gửi Má Bình Định,Trung Tín,1,,
1024,Chúng Con Canh Giấc Ngủ Cho Người,Phạm Mạnh Hùng (NSƯT),1,,
1025,Chuyện Tình Của Biển,Song Hỷ,1,,
1026,Người Chiến Sĩ Ấy,Vũ Tiến Lâm (NSƯT),1,,
1027,Chúng Tôi Hát Giữa Trường Sa,Công Lâm,1,,
1028,Điện Biên Mùa Chiến Công,Nam Hải,1,,
1029,Hoa Ban Mùa Này,Thái Hoàng Trung,1,,
1030,Tình Người Lính Tống,V.A,1,,
1031,Màu Áo Công An,Phan Nhã Ca,1,,
1032,Trên Đỉnh Trường Sơn Ta Hát,Đặng Huân Vinh,1,,
1033,Con Đường Của Bác,Cát Tiên,1,,
1034,Ba Đình Nắng,Quốc Hưng (NSND),1,,
1035,Khúc Hát Ru Người Mẹ Lính,Tuyết Lan,1,,
1036,Em Ở Nông Trường Em Ra Biên Giới,CLB Giai Điệu Trẻ TP Cần Thơ,1,,
1037,Hồn Thiên Cách Mạng,V.A,1,,
1038,Bài Ca Trường Sơn,Thu Giang,1,,
1039,Phất Cờ Nam Tiến,Lạc Việt,1,,
1040,Linh Thiêng Việt Nam,Lạc Việt,1,,
1041,Hồn Việt Nam,Lạc Việt,1,,
1042,Như Bác Về Thăm,"Công Quang, V.A",1,,
1043,Nhớ Tiên Hưng,Trung Đức (NSND),1,,
1044,Hào Khí Việt Nam,Trần Minh Tuấn,1,,
1045,Cánh Chim Báo Tin Vui,Hà My,1,,
1046,Bài Ca Chiến Sĩ Công An,Hoàng Minh Thắng,1,,
1047,Ngọc Hòa Ngàn Năm Tỏa Sáng,V.A,1,,
1048,Những Người Hát Bè Trầm,Phạm Chiến,1,,
1049,Gần Lắm Trường Sa,Thùy Dương,1,,
1050,Hà Nội Niềm Tin Và Hy Vọng,Quốc Hưng (NSND),1,,
1051,Hồn Thiêng Đất Việt,CLB Giai Điệu Trẻ TP Cần Thơ,1,,
1052,Hành Khúc Giải Phóng,CLB Giai Điệu Trẻ TP Cần Thơ,1,,
1053,Đồng Đội Ơi,Phạm Chiến,1,,
1054,Bắc Giang Quê Tôi,"Tuấn Anh, Hoàng Yến",1,,
1055,Xuân Trên Thành Phố Bác,Lạc Việt,1,,
1056,Xin Mưa Rào Lên Đỉnh E5,Tuấn Anh (NSƯT),1,,
1057,Mồ Hôi Đá,Huy Hoàng,1,,
1058,Chúng Con Canh Giấc Ngủ Cho Người,Hồ Đức Hùng,1,,
1059,Vì Biển Trời Tổ Quốc Ta Yêu,Tốp Ca QK2,1,,
1060,Đảng Là Cuộc Sống Của Tôi,Thái Hoàng Trung,1,,
1061,Bài Ca Hy Vọng,Sen Việt,1,,
1062,Vết Chân Tròn Trên Cát,Nguyễn Vinh Sơn,1,,
1063,Đêm Tuần Tra Cùng Sóng Gió,Dương Đức,1,,
1064,Ấm Tình Quê Bắc,Lương Nguyệt Anh,1,,
1065,Đêm Trăng Sông Lô,Hoàng Khanh,1,,
1066,Cúc Ơi,V.A,1,,
1067,Giấc Mơ Dưới Gốc Cây Bồ Đề Nghĩa Trang Trường Sơn,Phan Thu,1,,
1068,Có Ai Về Thanh Hóa,Lê Anh Dũng,1,,
1069,Đảng Là Cuộc Sống Của Tôi,Đặng Hiếu,1,,
1070,Miền Xa Thẳm,Khánh Linh,1,,
1071,"Truyền Thuyết Hoàng Sa, Trường Sa",Phan Mạnh Thắng,1,,
1072,Đạ Tẻh Bản Hùng Ca Ngời Sáng,"Nguyễn Thái Hiệp, Sức Sống Trẻ",1,,
1073,Hành Khúc Chiến Sĩ Tên Lửa Bờ,"Thế Hiển, Tốp Ca Nhánh Lan Rừng",1,,
1074,Lữ Đoàn Tên Lửa Bờ,"Nguyễn Văn Luân, Biển Xanh",1,,
1075,Lãnh Tụ Ca,V.A,1,,
1076,Tự Nguyện,Thế Huy,1,,
1077,Vì Sự Nghiệp Trồng Người,"Đức Tấn, Nguyễn Thùy Linh",1,,
1078,Hát Về Quê Hương Đại Tướng,Phạm Anh Tuấn,1,,
1079,Người Con Gái Miền Nam Anh Hùng,Black Eyes,1,,
1080,Truông Bồn Còn Đó Với Ngàn Năm,V.A,1,,
1081,Sông Dakrong Mùa Xuân Về 2015,Vũ Trọng Chinh,1,,
1082,Hướng Về Ánh Mặt Trời,V.A,1,,
1083,Người Hà Nội,Hà My,1,,
1084,Những Ánh Sao Đêm,Thanh Khuê,1,,
1085,Người Hà Nội,"Bùi Thắng, Giáp Thúy, V.A",1,,
1086,Hội Làng Sen,Xuân Huyền,1,,
1087,Tiếng Thì Thầm,Xuân Huyền,1,,
1088,Hành Khúc Hậu Cần QK2,V.A,1,,
1089,Bài Ca Hậu Cần QK2,V.A,1,,
1090,Con Tàu Thanh Niên,Sỹ Hùng BTA,1,,
1091,Gặp Nhau Trên Đỉnh Trường Sơn,V.A,1,,
1092,Nhớ Mùa Thu Tuyên Quang,Huy Quyết,1,,
1093,Nắng Ấm Về Trên Tổ Quốc,V.A,1,,
1094,Bài Ca Người Chiến Sỹ Áo Trắng,V.A,1,,
1095,Mẹ Tôi,Quốc Hưng (NSND),1,,
1096,Hát Cho Dân Tôi Nghe,Quốc Hưng (NSND),1,,
1097,Bình Minh Của Lính Tàu Ngầm,"Lê Chí Hiếu, Thiên Phú",1,,
1098,Điểm Danh Đồng Đội,Công Quang,1,,
1099,Lá Đỏ,Đình Hội,1,,
1100,Hưng Đạo Đại Vương,Viết Danh,1,,
1101,Đất Nước Trọn Niềm Vui,Đình Hội,1,,
1102,Người Lính Quân Hàm Xanh,V.A,1,,
1103,Xin Đón Các Anh Về,Vũ Tiến Lâm (NSƯT),1,,
1104,"Lời Người, Lời Nước Non",Vũ Tiến Lâm (NSƯT),1,,
1105,Từ Quảng Nam Con Về Thăm Quê Bác,Alăng Ngước,1,,
1106,Thành Sen Nhớ Bác,Thái Bảo,1,,
1107,Tình Yêu Bên Suối,V.A,1,,
1108,Lời Bác Giục Ta Đi Tới,V.A,1,,
1109,Chiến Sĩ Công An Làm Theo Lời Bác,Triệu Lộc,1,,
1110,Những Thành Phố Bên Bờ Biển Cả,Trường Linh,1,,
1111,Sức Sống Trường Sa,Long Nhật,1,,
1112,Ngàn Năm Thăng Long Đường Chúng Ta Đi,"Thiên Trung, Lâm Minh Chi",1,,
1113,Phú Thọ Mộ Khúc Ca Xanh,Hoài Nam,1,,
1114,Lính Hát,V.A,1,,
1115,Chân Trời Bất Tử,Huỳnh Lợi,1,,
1116,Bến Cảng Quê Hương Tôi,"Đức Quân, Chí Thành, Thành Chung",1,,
1117,Lá Đỏ,Quang Thịnh,1,,
1118,Hoàng Diệu Quê Hương Tôi,Vũ Thắng Lợi,1,,
1119,Hành Khúc Người Quản Giáo,V.A,1,,
1120,Người Lính Biên Phòng,Lạc Việt,1,,
1121,LK Thành Phố Hồ Chí Minh Niềm Tin Ngời Sáng - Việt Nam Ơi Mùa Xuân Đến Rồi,Lạc Việt,1,,
1122,Đường Chúng Ta Đi,Lạc Việt,1,,
1123,Lào Cai Ơn Nhớ Bác Hồ,V.A,1,,
1124,Cờ Bay Cao Chiếu Sáng Việt Nam,V.A,1,,
1125,Nỗi Đau Xin Hãy Sẻ Chia,V.A,1,,
1126,Câu Chuyện Bác Hồ,Thành Luân,1,,
1127,Cờ Bay Cao Chiếu Sáng,"Đức Thọ, Việt Long",1,,
1128,Hà Nội Một Trái Tim Hồng,Quang Học,1,,
1129,Tổ Quốc Yêu Thương,Thanh Bình,1,,
1130,Cảm Xúc Tháng Mười,Bùi Thắng,1,,
1131,Như Những Đóa San Hô,"Mai Trâm, Lạc Việt",1,,
1132,Tổ Quốc Con Tàu Và Người Thủy Thủ,Ngô Duy Thanh,1,,
1133,Những Chiến Sĩ Làm Chủ Lòng Đại Dương,"Khánh Vinh, Minh Cường, Cao Tiến Đạt",1,,
1134,Hát Về Một Tám Chín,Kông Lương,1,,
1135,Tự Hào Thành Phố Của Tôi,Phạm Hưng,1,,
1136,Người Chiến Sĩ Tàu Ngầm,"Nguyễn Thái Hiệp, Nguyễn Phi Hùng",1,,
1137,Lính Đặc Công Hát,V.A,1,,
1138,Tiếng Gió Hàng Dương,Thái Hòa,1,,
1139,Nhớ Nguyễn Du,Quốc Hưng (NSND),1,,
1140,Cờ Đảng Sáng Mãi Vùng Biên,Trung Cao,1,,
1141,Bình Trị Thiên Khói Lửa,Nguyễn Vinh Sơn,1,,
1142,Tự Hào Thành Phố Của Tôi,V.A,1,,
1143,Niềm Vui Thao Trường,Lạc Việt,1,,
1144,Lá Cờ Tổ Quốc Giữa Biển Đông,Quốc Hưng (NSND),1,,
1145,Tự Hào Nguyễn Văn Huyên,V.A,1,,
1146,Thế Gian Này Chỉ Riêng Bác Mà Thôi,Trần Khánh (NSND),1,,
1147,Bác Hồ Về Quê Tôi Chống Hạn,Vân Anh,1,,
1148,Tiếng Hát Từ Thành Phố Mang Tên Người,Lạc Việt,1,,
1149,Đảo Là Nhà Tổ Quốc Của Chúng Ta,Quang Phúc,1,,
1150,Quốc Ấn Đại Việt,Mạnh Cường,1,,
1151,Yêu Lính Đảo Xa,Viết Đại,1,,
1152,Ru Mẹ,Mạnh Cường,1,,
1153,Miền Xa Thẳm,Hà Chi,1,,
1154,Trung Đoàn 812,V.A,1,,
1155,Đảng Là Cuộc Sống Của Tôi,Thế Huy,1,,
1156,Đồng Đội Của Tôi,Vũ Tiến Lâm (NSƯT),1,,
1157,Dấu Chân Phía Trước,Vũ Tiến Lâm (NSƯT),1,,
1158,Hương Sắc Xứ Lạng,Phương Thảo,1,,
1159,Mỹ Thành Quê Tôi,Trần Hồng Nhung,1,,
1160,Tuổi Trẻ Phước Sơn Hành Khúc,Tốp Ca,1,,
1161,Hát Về Anh Người Con Trung Hiếu,Đinh Xuân Hội,1,,
1162,Hồi Tưởng,Trần Khánh (NSND),1,,
1163,Tây Ninh Rực Lửa Chiến Công,Lạc Việt,1,,
1164,Trong Lòng Đồng Bào,CLB Ngôi Sao Trẻ,1,,
1165,Trên Bến Đò Biên Giới,V.A,1,,
1166,Theo Chân Người Thợ Thành Đồng,Tốp Ca,1,,
1167,Nỗi Nhớ Tây Ninh,Bích Hảo,1,,
1168,Thưa Mẹ! Trái Tim,Thanh Hải,1,,
1169,Những Phòng Tuyến Áo Xanh,Ngọc Khoa,1,,
1170,Biên Cương Trong Trái Tim Người Lính,V.A,1,,
1171,Đảo Đá Trường Sa,Công Quang,1,,
1172,Mộ Gió Hùng Binh,Thanh Pháp,1,,
1173,Mỗi Người Mỗi Nhà Một Pháo Đài,V.A,1,,
1174,Ngày Trở Về (Vũ Khúc Ánh Trăng OST),Nguyễn Minh Quân,1,,
1175,Chí Sĩ Trần Cao Vân,V.A,1,,
1176,Tổ Quốc Nơi Trường Sa,Võ Văn Toàn,1,,
1177,Đảng Đã Cho Ta Sáng Mắt Sáng Lòng,Phi Hùng,1,,
1178,Tổ Quốc Ta Cờ Bay,Thăng Long Band,1,,
1179,Xin Hãy Đừng Quên,Hoàng Thiện,1,,
1180,Tìm Anh,Hồ Thanh Danh (NSƯT),1,,
1181,Bài Ca Thống Nhất,"Đặng Hồng Nhung, Tiến Hưng",1,,
1182,Tự Hào Biểu Tượng Chiến Thắng,Cảnh Tình,1,,
1183,Các Anh Nhận Được Chưa,Cảnh Tình,1,,
1184,Tự Nguyện,Thăng Long Band,1,,
1185,Hương Sứ Đất Hòn,Black Eye,1,,
1186,Bác Hồ Sống Mãi Với Tây Nguyên,Thăng Long Band,1,,
1187,Việt Bắc Đón Chào Ngày Mới,V.A,1,,
1188,Lá Cờ Đảng,Khắc Nội,1,,
1189,Rạng Ngời Tổ Quốc Việt Nam,Hải Đăng,1,,
1190,Lòng Dân Tây Nguyên Với Bác Hồ,V.A,1,,
1191,Tiếng Nói Của Nhân Dân,V.A,1,,
1192,Phút Lặng Thinh,Bùi Cẩm Huyền,1,,
1193,Dáng Đứng Tự Hào,V.A,1,,
1194,Đèo Cả - Người Mở Đường Vinh Quang,V.A,1,,
1195,Con Đường Của Bác,Hiền Anh,1,,
1196,Vọng Khúc Côn Lôn,Việt Hoàng,1,,
1197,Em Ở Nông Trường Em Ra Biên Giới,"Hà Chi, Ngọc Hồ",1,,
1198,Khúc Nhớ Đồng Đội,Xuân Huyền,1,,
1199,Hành Khúc Thanh Niên,Y Jang Tuyn,1,,
1200,Tuổi Trẻ Của Bác Hồ,CLB Giai Điệu Trẻ TP Cần Thơ,1,,
1201,Phú Riềng Vang Mãi Bản Hùng Ca,"Ngọc Sáng, Lê Huy",1,,
1202,Phú Riềng Sức Trẻ Ước Mơ Và Niềm Tin,CLB Ngôi Sao Trẻ,1,,
1203,Thương Quá Vị Xuyên,V.A,1,,
1204,Lửa Thiêng Phú Riềng,"Nguyễn Văn Luân, Sức Sống Trẻ",1,,
1205,Rạng Ngời Tổ Quốc Việt Nam,Huỳnh Lợi,1,,
1206,Mẹ Và Chiến Thắng,Thu Diệu,1,,
1207,Hành Khúc Thanh Niên Phú Riềng,"Bảo Huy, Black Eyes, Titikids",1,,
1208,Nụ Cười Trên Đất Phú Riềng,"Phạm Đăng Khương, Black Eyes",1,,
1209,Những Người Trẻ Nơi Đây,Nhóm K3,1,,
1210,Thăm Trường Sa,Vũ Tiến Lâm (NSƯT),1,,
1211,Lá Cờ Đảng,Việt Hoàng,1,,
1212,Trung Đoàn Ba Vì Anh Hùng,V.A,1,,
1213,Bài Ca Công An Phú Ninh,Tốp Ca QK2,1,,
1214,Tàu Anh Qua Núi (Live In Giao Lộ Thời Gian 2022),"Hòa Minzy, Thanh Hoa (NSND)",1,,
1215,Khúc Tráng Ca Biển,Đình Phong,1,,
1216,Bình Yên Hơi Thở Biển Đông,Hoàng Tùng,1,,
1217,Về Đi Các Anh Ơi,Thảo Ngân,1,,
1218,Vinh Quang Việt Nam,V.A,1,,
1219,Đường về Tây Côn Lĩnh,Vũ Thắng Lợi,1,,
1220,Cúc Ơi,Đắc Lợi,1,,
1221,Trở Lại Trường Sa,Minh Đức,1,,
1222,Lửa Thiêng Dân Tộc,Minh Tuấn,1,,
1223,Mùng Mười Tháng Ba,Lạc Việt,1,,
1224,Lời Mẹ,V.A,1,,
1225,Long Bình Quê Tôi,"Chính Thuận, Nguyễn Thị Kiều Oanh",1,,
1226,Cho Cuộc Sống Bình Yên,V.A,1,,
1227,Mấy Khi,Ngọt,2,,
1228,Để Được Thả Trôi,Giấy Gấp,2,,
1229,Cuối Ngày (Có Nhau Ver.),The Flob,2,,
1230,Nhật Kí,One Game,2,,
1231,Cuối Ngày,The Flob,2,,
1232,Chơi Đi! Chơi! Đi Chơi!,Jaigon Orchestra,2,,
1233,Cà Lem Kem Chuối,Đá Số Tới,2,,
1234,Muốn Bên Anh Bây Giờ,Tuyên,2,,
1235,Bạc Đầu,Jaigon Orchestra,2,,
1236,December,The Cassette,2,,
1237,Cơn Mưa Tháng 5 (Live),Bức Tường,2,,
1238,We Are Unstoppable,"Tuấn Khanh, Blacka, Triple D",2,,
1239,Mashup Mắt Đen Bông Hồng Thủy Tinh (Live),Bức Tường,2,,
1240,Lần Cuối (Đi Bên Em Xót Xa Người Ơi),Ngọt,2,,
1241,Dở Hơi,Xanh 8+1,2,,
1242,"Gia Đình Dấu Yêu (From From""Gia Đình Bất Đắc Dĩ"")",Đỗ Thụy Khanh,2,,
1243,Yêu,7UPPERCUTS,2,,
1244,Trúc Mai,Jaigon Orchestra,2,,
1245,Khoảng Cách,The Cassette,2,,
1246,Bài Thánh Ca Khó,Jaigon Orchestra,2,,
1247,Ánh Đèn Phố,The Cassette,2,,
1248,Hồng (Intro),Jaigon Orchestra,2,,
1249,Bùa Chú,"Jaigon Orchestra, Juan Phi",2,,
1250,Tựa Đêm Nay,The Cassette,2,,
1251,Sống,The A Plan,2,,
1252,Espresso,The Cassette,2,,
1253,Làm Sao Làm Sao Giờ Không Biết Luôn Á Đau Lòng Thiệt,DÍNH,2,,
1254,Con Đường Không Tên,Bức Tường,2,,
1255,Ngồi Đây Chi,X-Boyfriend,2,,
1256,Thang 10,Bức Tường,2,,
1257,Cá Rô,The Cassette,2,,
1258,Rừng Đom Đóm,The Cassette,2,,
1259,Vùng Đất Linh Hồn,The Cassette,2,,
1260,Nắng,The Cassette,2,,
1261,Mùa Đông Ở Lại,Bức Tường,2,,
1262,Ly Cafe Không Đường,Bức Tường,2,,
1263,Interlude: 9:00 Pm,The Cassette,2,,
1264,Binh Yen,Bức Tường,2,,
1265,Cô Ấy,Cá Hồi Hoang,2,,
1266,Là Tất Cả,Đá Số Tới,2,,
1267,Mấy Khi,Ngọt,2,,
1268,Để Được Thả Trôi,Giấy Gấp,2,,
1269,Cuối Ngày (Có Nhau Ver.),The Flob,2,,
1270,Nhật Kí,One Game,2,,
1271,Cuối Ngày,The Flob,2,,
1272,Chơi Đi! Chơi! Đi Chơi!,Jaigon Orchestra,2,,
1273,Cà Lem Kem Chuối,Đá Số Tới,2,,
1274,Muốn Bên Anh Bây Giờ,Tuyên,2,,
1275,Bạc Đầu,Jaigon Orchestra,2,,
1276,December,The Cassette,2,,
1277,Cơn Mưa Tháng 5 (Live),Bức Tường,2,,
1278,We Are Unstoppable,"Tuấn Khanh, Blacka, Triple D",2,,
1279,Mashup Mắt Đen Bông Hồng Thủy Tinh (Live),Bức Tường,2,,
1280,Lần Cuối (Đi Bên Em Xót Xa Người Ơi),Ngọt,2,,
1281,Dở Hơi,Xanh 8+1,2,,
1282,"Gia Đình Dấu Yêu (From From""Gia Đình Bất Đắc Dĩ"")",Đỗ Thụy Khanh,2,,
1283,Yêu,7UPPERCUTS,2,,
1284,Trúc Mai,Jaigon Orchestra,2,,
1285,Khoảng Cách,The Cassette,2,,
1286,Bài Thánh Ca Khó,Jaigon Orchestra,2,,
1287,Ánh Đèn Phố,The Cassette,2,,
1288,Hồng (Intro),Jaigon Orchestra,2,,
1289,Bùa Chú,"Jaigon Orchestra, Juan Phi",2,,
1290,Tựa Đêm Nay,The Cassette,2,,
1291,Sống,The A Plan,2,,
1292,Espresso,The Cassette,2,,
1293,Làm Sao Làm Sao Giờ Không Biết Luôn Á Đau Lòng Thiệt,DÍNH,2,,
1294,Con Đường Không Tên,Bức Tường,2,,
1295,Ngồi Đây Chi,X-Boyfriend,2,,
1296,Thang 10,Bức Tường,2,,
1297,Cá Rô,The Cassette,2,,
1298,Rừng Đom Đóm,The Cassette,2,,
1299,Vùng Đất Linh Hồn,The Cassette,2,,
1300,Nắng,The Cassette,2,,
1301,Mùa Đông Ở Lại,Bức Tường,2,,
1302,Ly Cafe Không Đường,Bức Tường,2,,
1303,Interlude: 9:00 Pm,The Cassette,2,,
1304,Binh Yen,Bức Tường,2,,
1305,Cô Ấy,Cá Hồi Hoang,2,,
1306,Là Tất Cả,Đá Số Tới,2,,
1307,Chuyển Kênh (Sản Phẩm Này Không Phải Là Thuốc),Ngọt,2,,
1308,Đông Rồi Tây,The Flob,2,,
1309,Hoa Hướng Dương,GMEZ,2,,
1310,Bùa Chú,Jaigon Orchestra,2,,
1311,Địa Ngục Trần Gian,Phạm Kỳ,2,,
1312,Tiếc,Jaigon Orchestra,2,,
1313,Hát Cùng Nhịp Đàn,Vũ Ngọc Báu,2,,
1314,Ánh Sáng,"Jaigon Orchestra, yeuquaimohihi",2,,
1315,Đừng Nói Tôi Điên,PB Live Band,2,,
1316,Cho,Ngọt,2,,
1317,Em Dạo Này,Ngọt,2,,
1318,Nứt (Đôi Chân Đôi Tay Đôi Mắt Trái Tim),Ngọt,2,,
1319,Cho Tôi Đi Theo,Ngọt,2,,
1320,Hết Thời,Ngọt,2,,
1321,Một Ngày Không Mưa,Ngọt,2,,
1322,Wave Alpha,"7UPPERCUTS, CAM",2,,
1323,Phai,MicroWave,2,,
1324,Ước Muốn,Bức Tường,2,,
1325,Quả Tim Màu Lửa,Kiên Trịnh,2,,
1326,Nhu Mì,"Jaigon Orchestra, tú tú",2,,
1327,Sống Sai,The Flob,2,,
1328,Nghe Những Tiếng Vang,"Urabe, PC",2,,
1329,"Chuyện Cũ, Đừng Nhắc Lại",Những Đứa Trẻ,2,,
1330,Tuổi Thơ Bé,Bức Tường,2,,
1331,Ký Ức,Bức Tường,2,,
1332,Cốc Nước Hong Em?,Chuột Sấm Sét,2,,
1333,Mất Điện,Nam Thế Giới,2,,
1334,Chuyện Tình Trương Chi,WHEE!,2,,
1335,Ngộ (Rock Version),"Lăng LD, KHOA",2,,
1336,Trái Tim Cô Đơn,"IMATXI, Killic",2,,
1337,Em Có Chắc Không,Ngọt,2,,
1338,Lối Rẽ,Bức Tường,2,,
1339,Có Bao Giờ,"The Meo, Freaky",2,,
1340,Đi Về Phía Chân Trời,"Giấy Gấp, Rock Việt",2,,
1341,Khoảng Trống,Bức Tường,2,,
1342,Trên Mái Nhà,Xanh 8+1,2,,
1343,Chuyến Xe,Giấy Gấp,2,,
1344,Em Ăn Gì,"Cút Lộn, Aki (7UPPERCUTS)",2,,
1345,"""NGHIỆP""","Metanoia, Rock Việt",2,,
1346,Chờ Tôi,Trini,2,,
1347,Tìm Người Nhà,Ngọt,2,,
1348,Như Trong Mơ,Xanh 8+1,2,,
1349,Đôi Chân Trần,Ygaria,2,,
1350,Chuyến Đi Dài,Xanh 8+1,2,,
1351,Alright,The Flob,2,,
1352,Đông Cuối,PB Live Band,2,,
1353,Nồng Nàn Cao Nguyên,Ygaria,2,,
1354,Mất Lối,"Brainwavez, Rock Việt",2,,
1355,Những Ngày Tháng Tuyệt Vời,Bức Tường,2,,
1356,Bé,Ngọt,2,,
1357,Nhạc Sàn,Wừu,2,,
1358,Mashup Tâm Hồn Của Đá - Nụ Hôn Trên Đỉnh Phan Xi Păng - Tìm Lại,"Old Bois Band, Rock Việt",2,,
1359,Những Chuyến Đi Dài,Bức Tường,2,,
1360,Xanh,Ngọt,2,,
1361,Tỉnh,POSEIDOSE,2,,
1362,Có Những Thế Giới,Bụi Gió,2,,
1363,Home Sweet Home,District105,2,,
1364,Giả Vờ,Ngọt,2,,
1365,Đi Tìm,Bumblebee,2,,
1366,Giấc Mơ,"WHEE!, Rock Việt",2,,
1367,Phong Lan Đá,"Powerk, Trang Tiny, NS Xuân Dũng",2,,
1368,(Tôi) Đi Trú Đông,Ngọt,2,,
1369,Mặt Nạ,"Cheffin', Rock Việt",2,,
1370,Lối,"Metanoia, Rock Việt",2,,
1371,Alright (Alternative),The Flob,2,,
1372,Dạo Gần Đây,Thoại 004,2,,
1373,Em Deo Biet Nua Anh Oi,7UPPERCUTS,2,,
1374,Lắng Động,"POSEIDOSE, Rock Việt",2,,
1375,Tìm Đâu,Band Nhạc Không Chất Lượng,2,,
1376,Một Đêm,Nguyễn Lê Ngọc Báu,2,,
1377,Chớm Đông,"Bumblebee, Rock Việt",2,,
1378,Ở Nhà Đêêê,The Flob,2,,
1379,Vô Tình,"Tiến Nguyễn, Tổng Đài",2,,
1380,Chuông Báo Thức,Ngọt,2,,
1381,Kẻ Thù,Ngọt,2,,
1382,Thiên Cổ,"MicroWave, Võ Lâm Truyền Kỳ",2,,
1383,Sợ Covid,AMER,2,,
1384,Yêu,"Ngũ Cung, Nguyễn Đức Cường",2,,
1385,Bản Tình Ca Tháng 5,Bức Tường,2,,
1386,Người Yêu Cũ (Acoustic Version),Jaigon Orchestra,2,,
1387,Ngọn Nến Sáng Nhất,"Bumblebee, Rock Việt",2,,
1388,Con - Người,Bo Bluesy,2,,
1389,Chiến Thần Vô Cực (Infinity Nado III),Trần Lập,2,,
1390,ROCKVIBES,DESOLATE,2,,
1391,Hổng biết luôn người yêu ơi,ChipPunks,2,,
1392,Xin Cho Tôi,Ngọt,2,,
1393,W.I.N.G,"Brainwave, Rock Việt",2,,
1394,Âm Nhạc II,Những Đứa Trẻ,2,,
1395,Đừng Vội Buông Tay,"Nòw, Rock Việt",2,,
1396,Thằng Bé,"POSEIDOSE, Rock Việt",2,,
1397,B52,"PB Live Band, JC Hưng, TSIXK",2,,
1398,Chuyện Làng Bên,Thoại 004,2,,
1399,July,The Cassette,2,,
1400,Chiếc Xe Van,"Mèow Lạc, Rock Việt",2,,
1401,Vệt Son 00:12,"WHEE!, Rock Việt",2,,
1402,Đi Tìm Lời Ru Nữ Thần Mặt Trời,Ygaria,2,,
1403,Mỗi Khi Đêm Về,"Minh Đinh, Ngơ",2,,
1404,B (Si),POSEIDOSE,2,,
1405,She's Gone,"Bumblebee, Rock Việt",2,,
1406,Chuồn Chuồn,"Chú Cá Lơ, Rock Việt",2,,
1407,Chú Chim Sơn Ca,POSEIDOSE,2,,
1408,Cho Tôi Đi Theo (Ballad Version),Ngọt,2,,
1409,Sống Trọn Từng Giây,"Aqua Band, Rock Việt",2,,
1410,Khờ,Raditori,2,,
1411,Buổi Hẹn Cuối Cùng,Nam Thế Giới,2,,
1412,Vì Ai,Ngọt,2,,
1413,Trời Cao Biển Rộng,Ngọc Hà,2,,
1414,Tàu Nhanh,Mèow Lạc,2,,
1415,Hạnh Phúc Khi Anh Có Em,PB Live Band,2,,
1416,Đàn Chim Di Cư (Rock Version),"Avin Lu, Hồ Minh Ngọc",2,,
1417,Get Away,Raccoon,2,,
1418,Chân Thật,Band Nhạc Không Chất Lượng,2,,
1419,Con Ong (Xin Em Đừng Nghĩ Suy),Những Đứa Trẻ,2,,
1420,Lời Khó Nói,DayOff,2,,
1421,Nhu Mì (Nhạc Sống Miệt Vườn),Jaigon Orchestra,2,,
1422,Không Vui (Outro),Raditori,2,,
1423,Đến Với Cao Nguyên,Ygaria,2,,
1424,Xin Cho Tôi,Ngọt,2,,
1425,Sống! Hay Tồn Tại,"Aqua Band, Rock Việt",2,,
1426,Mặt Trời Không Lên,The A Plan,2,,
1427,Ngả Nghiêng (Ep Version),Minh Đinh,2,,
1428,Khúc Hát Tuổi Trẻ,"Giấy Gấp, Rock Việt",2,,
1429,Đâu Đó Giữa Những Bất An Và Mưu Cầu Hạnh Phúc,Nam Thế Giới,2,,
1430,Cô Gái Tương Lai,Nam Thế Giới,2,,
1431,Take Off (Hard Rock Version),"Hoàng Rapper, Nguyễn Dân",2,,
1432,Mèo Hoang,Ngọt,2,,
1433,Bài Funky Cho Em,The Meo,2,,
1434,Say,"Unlock Band, Rock Việt",2,,
1435,Ước Mơ Như Con Thuyền,"Phách Ca, Rock Việt",2,,
1436,Bartender,Ngọt,2,,
1437,Ly Cafe Ban Mê,Ygaria,2,,
1438,Kho Báu,Ngọt,2,,
1439,Quên,Raditori,2,,
1440,Gạt 2,Brainwave,2,,
1441,À Ơi,Ngọt,2,,
1442,Việt Quất Mật Ong,Nam Thế Giới,2,,
1443,Vườn Cây Và Ánh Mặt Trời,Nam Thế Giới,2,,
1444,Kaycee,Jaigon Orchestra,2,,
1445,Minh Mẫn,Raditori,2,,
1446,Đi Tìm Bóng Núi,Ygaria,2,,
1447,Đồng Tiền & Quyền Lực,"Huỳnh James, Pjnboys",2,,
1448,Long Gone,The Cassette,2,,
1449,Tiếng Đàn Goong Lu,Ygaria,2,,
1450,Vui (Intro),Raditori,2,,
1451,BÃO,NevaDie,2,,
1452,Chó Sủa Người Đi,Huy Râu,2,,
1453,Cá Hồi (Live),Ngọt,2,,
1454,Người Thị Phi,Thoại 004,2,,
1455,Tôi Người Hải Phòng,Tuấn RC,2,,
1456,Gọi Em,Ygaria,2,,
1457,Thiên Thần Về Giời,Minh Đinh,2,,
1458,When The Star Come Out,The Cassette,2,,
1459,Hoa Tàn Hoa Nở,Audicity,2,,
1460,Vàng,Nam Thế Giới,2,,
1461,Người Đàn Bà Hóa Đá (Live),"Nguyễn Văn Thắng, Hà Văn Đông",2,,
1462,Sống,Metanoia,2,,
1463,Đầu Tiên Là Tiền Đâu?,89 Band,2,,
1464,Quan Điểm,Ngọt,2,,
1465,Đừng Để Nhau Rơi,Minh Đinh,2,,
1466,Vô Cảm,"DJ TUS, TRUNG HIPS, LMT",2,,
1467,Anh Chỉ Muốn Bên Em Mà Thôi,Band Nhạc Không Chất Lượng,2,,
1468,You Were The Only Good Thing Happened Last Summer,7UPPERCUTS,2,,
1469,Everybody Wants To Be Loved,The Cassette,2,,
1470,Người Yêu Mới (Acoustic Version),Jaigon Orchestra,2,,
1471,Vòng Lặp,Phách Ca,2,,
1472,Gạt,Brainwave,2,,
1473,Không Làm Gì,Ngọt,2,,
1474,Bóng Đen,Jack - J97,2,,
1475,Cao Nguyên Vào Mùa,Ygaria,2,,
1476,Về Dưới Ánh Mặt Trời,Cheffin',2,,
1477,Drama Queen,Ngọt,2,,
1478,Vài Lời Nói,Nam Thế Giới,2,,
1479,Psychotramps's Anthem,"Trần Trung Lĩnh, Nguyễn Hồng Việt",2,,
1480,Chuyện Ruồi,KLAF,2,,
1481,Vết Nhơ,Đông Đô,2,,
1482,Chào Buổi Sáng,"Cheffin', Rock Việt",2,,
1483,Cùng Chạy,Brainwave,2,,
1484,Bắc Kim Thang,ATM,2,,
1485,Sầu Riêng,Minh Đinh,2,,
1486,Không Tưởng (R.E.M),Trần Thu Hà,2,,
1487,Mưa Bóng Mây,Mèow Lạc,2,,
1488,Ở Đó,Thoại 004,2,,
1489,Be Cool,Ngọt,2,,
1490,Sẽ Không Yêu Thêm Ai (Country Rock Version),Tạ Quang Thắng,2,,
1491,Ký Ức Xa Lạ,The Meo,2,,
1492,Vì Sao,Nhà Kho,2,,
1493,Vô Hình,Raditori,2,,
1494,Khắp Xung Quanh,Ngọt,2,,
1495,Sài Gòn Hôm Nay,Nhã Ca,2,,
1496,"Ngày Bé, Lúc Lớn",Những Đứa Trẻ,2,,
1497,Trống Vắng (Rock Version),Phương Thanh,2,,
1498,Quên,MicroWave,2,,
1499,Từ Đó Cover,"Tổng Đài, Tiến Nguyễn",2,,
1500,Phát Điên,"Chú Cá Lơ, Rock Việt",2,,
1501,Giấc Mơ Từng Mơ,"Solar Eclipse, Rock Việt",2,,
1502,Sai,MicroWave,2,,
1503,Bay 2,MicroWave,2,,
1504,Cám Dỗ,Voluptuary,2,,
1505,"Nhất Quỷ, Nhì Ma, Thứ Ba Lũ Quạ",Mèow Lạc,2,,
1506,Giấc Mơ Còn Mãi,"Bohemian Hideaway, Thành Luke",2,,
1507,XXV,Bức Tường,2,,
1508,Rơi,"BOF, Rock Việt",2,,
1509,Đừng Để Nhau Rơi,Minh Đinh,2,,
1510,Chỉ Là Giấc Mơ,MicroWave,2,,
1511,Có Lúc,Trini,2,,
1512,Trông Hơi Quá Đà,Thu Vũ,2,,
1513,Ngày Cuối,"Solar Eclipse, Rock Việt",2,,
1514,Một Ngày Hạ,"Mèow Lạc, Rock Việt",2,,
1515,She Neva Know (Remix 2012 ),"JustaTee, DJ",2,,
1516,Ngựa Ô Thương Nhớ,Phạm Anh Khoa,2,,
1517,Kho Báu,Ngọt,2,,
1518,"Nhất Quỷ, Nhì Ma, Thứ Ba Lũ Quạ",Mèow Lạc,2,,
1519,Đánh Đàn,Raditori,2,,
1520,Vỡ,Raditori,2,,
1521,Wait (Acoustic Version),Oringchains,2,,
1522,Cho Tôi Đam Mê,Giấy Gấp,2,,
1523,Tháng Năm,Second Attempt,2,,
1524,Rose,Windrunner,2,,
1525,Nhớ,MicroWave,2,,
1526,Trôi,Bột Màu Khoai Tây Cà Rốt,2,,
1527,Bão Đêm,MicroWave,2,,
1528,Shoe!,Nam Thế Giới,2,,
1529,Đường Đến Ngày Vinh Quang,V.A,2,,
1530,Ngày Rạo Rực,Thành Luke,2,,
1531,Khi Ta Không Còn Nhau,iTễu,2,,
1532,Đông Chí,"Unlock, Rock Việt",2,,
1533,Man Lê 1979,Ngũ Cung,2,,
1534,Giữ Ấm Bếp Hồng,Ygaria,2,,
